full_text_comments,full_text_comments_preprocessed
@Metro_TV Jangan suka suuzdon pak....wong negara lain mau bantu kok gak boleh malah dikira tidak suka dengan Indonesia....kita aja boleh bantu Palestine...kenapa negara lain ngk boleh bantu negara kita yang kesusahan pak,jangan suka suuzdon pakwong negara lain mau bantu kok gak boleh malah dikira tidak suka dengan indonesiakita aja boleh bantu palestinekenapa negara lain ngk boleh bantu negara kita yang kesusahan pak
"@Metro_TV Pemerintah @prabowo sedang melawan rakyatnya sendiri! 
Kita lihat siapa yang menang!
@DPR_RI @DPDRI @Aceh @_bemsi @BEMFISIPUI @BEMUNJ_OFFICIAL @BEMFEBUI @Sumaterautaraa @SumbarPemprov @ILCTalkshow @aniesbaswedan @mohmahfudmd",pemerintah sedang melawan rakyatnya sendiri kita lihat siapa yang menang
"@Metro_TV Kenyataan @prabowo:
1. Hrs diakui bahwa penanganan bencana tdk tuntas
2. Dana pempus&amp;Pemda SDH dipotong utk MBG, habis!
3. Gaza mode ala Zionis: ada jutaan korban kehilangan rumah, keluarga, kelaparan, kedinginan dan tanpa obat. Bantuan negara lain diblokir.

Rakyat berhak marah!",kenyataan hrs diakui bahwa penanganan bencana tdk tuntas dana pempusamppemda sdh dipotong utk mbg habis gaza mode ala zionis ada jutaan korban kehilangan rumah keluarga kelaparan kedinginan dan tanpa obat bantuan negara lain diblokir rakyat berhak marah
@Metro_TV Kemarin pihaj asing sekarang berganti pihak luar,kemarin pihaj asing sekarang berganti pihak luar
@Metro_TV Kapasitas negara luar bantu korban banjir semata mata adalah aksi bantuan kemanusiaan bukan agenda politik praktis.,kapasitas negara luar bantu korban banjir semata mata adalah aksi bantuan kemanusiaan bukan agenda politik praktis
@Metro_TV Hidupnya penuh dengan halusinasi,hidupnya penuh dengan halusinasi
@Metro_TV https://t.co/HzuzDo2QqD,
@Metro_TV Ngomong opo bapak iki...ora ngerti kue,ngomong opo bapak ikiora ngerti kue
"@Metro_TV Di Aceh, Muzakarah Ulama yang minta bantuan asing. 🤔",di aceh muzakarah ulama yang minta bantuan asing
@Metro_TV https://t.co/IGvMPViixm,
@Metro_TV Asing https://t.co/eXGGjiWnou,asing
"@Metro_TV Walah, presiden Prabowo lemot malah ngeles cari kambing hitam. Parah lu Wo",walah presiden prabowo lemot malah ngeles cari kambing hitam parah lu wo
@Metro_TV Aku ah...gak jelas,aku ahgak jelas
@Metro_TV Makanya beliau kitika di kasih cermin tdk mau ngaca 😢😢😢,makanya beliau kitika di kasih cermin tdk mau ngaca
"@Metro_TV Halah, proooott...",halah proooott
@Metro_TV bosen bisanya tuding pihak luar mulu,bosen bisanya tuding pihak luar mulu
@Metro_TV Daripada ngomongin orang bagus pikirkan hal lain yang produktif,daripada ngomongin orang bagus pikirkan hal lain yang produktif
@Metro_TV Simply ..  set up media crisis center aj pak No one will buy wordings from your cabinet,simply set up media crisis center aj pak no one will buy wordings from your cabinet
"@Metro_TV Masih aja kambing hitam kekuatan luar !!!
Berpikir diluar nalar",masih aja kambing hitam kekuatan luar berpikir diluar nalar
"@Metro_TV Korban bencana tdk mmbutuhkn prnyataan atw narasi2 tuk pncitraan krna sdh bosan gaya jokowi yg sprti itu!!! Korban bncana mmbutuhkn bantuan langsung tuk brteduh,makan,minum n mncri korban yg blm ktemu.,itu yg hrs pemerintah lakukan skrg.,aksi bukan narasi!!!",korban bencana tdk mmbutuhkn prnyataan atw narasi tuk pncitraan krna sdh bosan gaya jokowi yg sprti itu korban bncana mmbutuhkn bantuan langsung tuk brteduhmakanminum n mncri korban yg blm ktemuitu yg hrs pemerintah lakukan skrgaksi bukan narasi
@Metro_TV BACOT PHOBIA..,bacot phobia
"@Metro_TV Sepertinya Bapak Presiden RI yang terhormat ini terkena #phobia seperti ketakutan..tenang pak Presiden RI yang terhormat @prabowo selagi Bapak jujur kami Rakyat Indonesia bersatu untuk adanya serangan asing..!!!
#stopbohongirakyat",sepertinya bapak presiden ri yang terhormat ini terkena phobia seperti ketakutantenang pak presiden ri yang terhormat selagi bapak jujur kami rakyat indonesia bersatu untuk adanya serangan asing stopbohongirakyat
"@Metro_TV jangan loloskan. dia kuasai pemerintahan, dia merampok hak-hak orang indonesia",jangan loloskan dia kuasai pemerintahan dia merampok hakhak orang indonesia
"@Metro_TV Faktanya Laporan banyak ABS Mr Presiden @prabowo 
Fokus PERCEPATAN #TNI BANTUAN #PMI (Masy dan Internasional lewat sini, lumrah kok) REKONSTRUKSI WILAYAH #KEMENPUPR 
KONTROL percayakan Mr @sjafriesjams 
Dananya? Stop 1 bulan MBG cukup, kurang perintahkan Bang @PurbayaYudhi beres.",faktanya laporan banyak abs mr presiden fokus percepatan tni bantuan pmi masy dan internasional lewat sini lumrah kok rekonstruksi wilayah kemenpupr kontrol percayakan mr dananya stop bulan mbg cukup kurang perintahkan bang beres
@Metro_TV Osang aseng.. Oseng oseng enak pak pak,osang aseng oseng oseng enak pak pak
"@Metro_TV Kekuatan luar mengacau adl keniscayaan sejak zaman purba. Mulai antar suku, kelompok, kerajaan, bangsa, negara. Ndak hrs diherankan. Sbg presiden harusnya fokus memperkuat ketahanan bangsa mll peningkatan kesejahteraan masyarakat dan saat ini menangani bencana benar2 demi rakyat",kekuatan luar mengacau adl keniscayaan sejak zaman purba mulai antar suku kelompok kerajaan bangsa negara ndak hrs diherankan sbg presiden harusnya fokus memperkuat ketahanan bangsa mll peningkatan kesejahteraan masyarakat dan saat ini menangani bencana benar demi rakyat
@Metro_TV https://t.co/fsbgb3ggJT,
@Metro_TV Nah itu beliau yg faham kita rakyat ikut ap kta dia,nah itu beliau yg faham kita rakyat ikut ap kta dia
@Urrangawak logistik aceh itu gak segampang update status 🚚,logistik aceh itu gak segampang update status
@Urrangawak presiden juga ngerti kondisi bencana gak hitam putih,presiden juga ngerti kondisi bencana gak hitam putih
@Urrangawak lapor ke presiden itu kewajiban menteri bukan prank 😅,lapor ke presiden itu kewajiban menteri bukan prank
@Urrangawak lapangan dinamis bro data bisa berubah cepat,lapangan dinamis bro data bisa berubah cepat
@Urrangawak kalau ada selisih data ya diperbaiki bareng bukan langsung nuduh 🤷‍♂️,kalau ada selisih data ya diperbaiki bareng bukan langsung nuduh
@direktoridosen @muhammadiyah Allhamdulillah MU,allhamdulillah mu
@direktoridosen @muhammadiyah Muhammadiyah kerennn,muhammadiyah kerennn
@direktoridosen @muhammadiyah Sikap 🙌🏼🔥🔥🔥,sikap
@direktoridosen GASSSSS,gasssss
@direktoridosen @muhammadiyah Menyala selaluuuuwww,menyala selaluuuuwww
@direktoridosen @muhammadiyah Glory glory MU,glory glory mu
@direktoridosen @muhammadiyah Sang Surya tetap bersinar,sang surya tetap bersinar
@direktoridosen @sandalhermesss @muhammadiyah Dukung langkah MUHAMMADIYAH,dukung langkah muhammadiyah
"@direktoridosen @muhammadiyah I know Its Will be a nice move, but versus the number 1 rn? Well, good luck then",i know its will be a nice move but versus the number rn well good luck then
@direktoridosen @alfiarnggns @muhammadiyah Menyala MU (MUhammadiyah)🔥,menyala mu muhammadiyah
"@direktoridosen @muhammadiyah kita kawal, kita dukung",kita kawal kita dukung
"@direktoridosen @muhammadiyah Kenapa LBH PP ngotot..harus ditetapkan bencana nasional...pusat punya kepentingan politik lain..agar daerah yg terdampak harus benar"", patuh baru mau dibantu...",kenapa lbh pp ngototharus ditetapkan bencana nasionalpusat punya kepentingan politik lainagar daerah yg terdampak harus benar patuh baru mau dibantu
@direktoridosen @muhammadiyah Bisa digantiin wapres nya ikih..,bisa digantiin wapres nya ikih
@direktoridosen @muhammadiyah Membanggakan,membanggakan
@direktoridosen @muhammadiyah Takbir !!!!,takbir
@direktoridosen @muhammadiyah Menyala MU🫶,menyala mu
@direktoridosen @muhammadiyah Dukuuuung!!,dukuuuung
"@direktoridosen @koen_ed @muhammadiyah Kalo @nahdlatululama @nu_online siap menempuh apa kah?
Apa masih rebutan tambang kah?",kalo siap menempuh apa kah apa masih rebutan tambang kah
"@direktoridosen @ruhaeniintan @muhammadiyah Presiden @prabowo kepala batu
Keras kepala
Batu hitam 
Batu neraka jahannam yang terkutuk",presiden kepala batu keras kepala batu hitam batu neraka jahannam yang terkutuk
@direktoridosen @muhammadiyah Menyala Muhammadiyah 🔥❤🙏🏼,menyala muhammadiyah
@BarisanOpOsisi Jangan salahkan pemimpin/penguasa saja coba pertanyakan juga kapasitas ulamanya. Penguasa lahir karena dukungan ormas2 besar. Ormas besar klo berkualitas silahkan aja. Masalahnya ?....,jangan salahkan pemimpinpenguasa saja coba pertanyakan juga kapasitas ulamanya penguasa lahir karena dukungan ormas besar ormas besar klo berkualitas silahkan aja masalahnya
@BarisanOpOsisi Bener banget,bener banget
@BarisanOpOsisi Lengkap 😥,lengkap
@BarisanOpOsisi https://t.co/VLt6ogqDng,
"@BarisanOpOsisi Presiden Prabowo dlm rakor dgn para Menterinya sdh wanti2 klo dimaki oleh Rakyat diemin aja itu sdh resikonya,jadi klo Rakyat teriak2 percuma mending diem aja gak akan digubris dah gitu aja",presiden prabowo dlm rakor dgn para menterinya sdh wanti klo dimaki oleh rakyat diemin aja itu sdh resikonyajadi klo rakyat teriak percuma mending diem aja gak akan digubris dah gitu aja
@BarisanOpOsisi Wapres Vorno 🤣🤣,wapres vorno
@BarisanOpOsisi Sadis bu,sadis bu
@BarisanOpOsisi Kurang lengkap apalagi coba... 😆,kurang lengkap apalagi coba
@BarisanOpOsisi Innalilahi wa Inna ilaihi Raji'un.,innalilahi wa inna ilaihi rajiun
@BarisanOpOsisi Yg posting berasa paling suci dan tahu segalanya mau ambil alih job malaikat ato Tuhan...?,yg posting berasa paling suci dan tahu segalanya mau ambil alih job malaikat ato tuhan
"@BarisanOpOsisi Dan WNI diuji dengan bencana, penyakit, kemiskinan, AKIBAT ketidakkompetenan pemerintahnya yang mirip Fir'aun dan punya Wapres yang planga plongo",dan wni diuji dengan bencana penyakit kemiskinan akibat ketidakkompetenan pemerintahnya yang mirip firaun dan punya wapres yang planga plongo
@kusuma4a Hanya bisa berkata terima kasih baktimu TNI ku😚,hanya bisa berkata terima kasih baktimu tni ku
@kusuma4a Salut untuk kesiapsiagaan yang selalu terjaga.,salut untuk kesiapsiagaan yang selalu terjaga
@kusuma4a Kepemimpinan Bapak KASAD patut menjadi teladan.,kepemimpinan bapak kasad patut menjadi teladan
"@kusuma4a Terimakasih bapak Kasad dan prajurit TNI atas bantuan cepat menanggulangi bencana, bravo tni",terimakasih bapak kasad dan prajurit tni atas bantuan cepat menanggulangi bencana bravo tni
@kusuma4a Salut kepada TNI AD yang bergerak cepat tanpa menunggu lama demi keselamatan warga.,salut kepada tni ad yang bergerak cepat tanpa menunggu lama demi keselamatan warga
@kusuma4a Kerja sama dan bantuan yang di salurkan TNI AD adalah bukti nyata TNI hadir untuk rakyat,kerja sama dan bantuan yang di salurkan tni ad adalah bukti nyata tni hadir untuk rakyat
"@kusuma4a Kerja nyata, tetap semanggat pak TNI. Bravo TNI",kerja nyata tetap semanggat pak tni bravo tni
@kusuma4a Selalu tuntas klo tni yg ambil alih 🔥🔥,selalu tuntas klo tni yg ambil alih
"@kusuma4a Respect, respon TNI yang sangat cepat. Sehingga korban tidak merasa sendirian karena negara selalu hadir di dalamnya.",respect respon tni yang sangat cepat sehingga korban tidak merasa sendirian karena negara selalu hadir di dalamnya
@kusuma4a Bangga kami atas kinerja TNI 😇,bangga kami atas kinerja tni
@kusuma4a Hormat bangga kepada seluruh jajaran TNI dan lapisan masyarakat yang berjuang untuk pemulihan bencana..,hormat bangga kepada seluruh jajaran tni dan lapisan masyarakat yang berjuang untuk pemulihan bencana
"@kusuma4a Respon cepat tni luar biasa, tni bersama rakyat untuk indonesia",respon cepat tni luar biasa tni bersama rakyat untuk indonesia
@kusuma4a Pernyataan kasad sesuai dengan realita karena respon cepat TNI di rasakan masyarakat,pernyataan kasad sesuai dengan realita karena respon cepat tni di rasakan masyarakat
"@kusuma4a Mantap lanjutkan kerjanya, bukti kalau bukan omong kosong, semoga sukses",mantap lanjutkan kerjanya bukti kalau bukan omong kosong semoga sukses
@kusuma4a Salut kepada bapak TNI tanpa banyak bicara tapi langsung action,salut kepada bapak tni tanpa banyak bicara tapi langsung action
@kusuma4a Semoga seluruh prajurit yang bertugas diberikan kesehatan dan keselamatan.,semoga seluruh prajurit yang bertugas diberikan kesehatan dan keselamatan
@kusuma4a Kami bangga dan terima kasih atas jasamu dalam penanggulangan serta respon cepat,kami bangga dan terima kasih atas jasamu dalam penanggulangan serta respon cepat
@kusuma4a Kerja cepat TNI adalah bukti nyata TNI hadir di garis depan untuk masyarakat,kerja cepat tni adalah bukti nyata tni hadir di garis depan untuk masyarakat
@kusuma4a karyamu tidak perlu diragukan lagi bapak TNI semangat ya pak,karyamu tidak perlu diragukan lagi bapak tni semangat ya pak
@kusuma4a Semangat TNI untuk membantu rakyat,semangat tni untuk membantu rakyat
@kusuma4a Langkah sigap TNI AD sangat membantu percepatan proses evakuasi dan pemulihan.,langkah sigap tni ad sangat membantu percepatan proses evakuasi dan pemulihan
"@kusuma4a Terimakasih TNI, sudah menjadi garda terdepan untuk masyarakat terdampak bencana",terimakasih tni sudah menjadi garda terdepan untuk masyarakat terdampak bencana
"@kusuma4a terimakasih bapak kasad, semoga sumatera lekas membaik",terimakasih bapak kasad semoga sumatera lekas membaik
"@kusuma4a Bencana datang tiba-tiba, tapi TNI hadir secepat mungkin. Itu bikin warga merasa aman.",bencana datang tibatiba tapi tni hadir secepat mungkin itu bikin warga merasa aman
@kusuma4a Tugas mulia TNI di garis depan untuk masyarakat dan semoga sehat selalu,tugas mulia tni di garis depan untuk masyarakat dan semoga sehat selalu
@kusuma4a Mantap Bapak TNI selalu cepat menghadapi tantangan,mantap bapak tni selalu cepat menghadapi tantangan
@kusuma4a Pernyataan Kasad didukung fakta di lapangan.,pernyataan kasad didukung fakta di lapangan
@kusuma4a Terus berkarya pak agar saudara kita bisa beraktifitas lagi,terus berkarya pak agar saudara kita bisa beraktifitas lagi
Busy week this Christmas - had the pleasure of joining some terrific shows - we'll start with @FoxNews on Christmas Day with @RichEdsonDC where we discussed the economy and a forward look to 2026. https://t.co/Tj7ZYZ25Js,busy week this christmas had the pleasure of joining some terrific shows well start with on christmas day with where we discussed the economy and a forward look to
@kusuma4a Sehat selalu Bapak KASAD agar bisa terus memimpin TNI AD membantu rakyat.,sehat selalu bapak kasad agar bisa terus memimpin tni ad membantu rakyat
@kusuma4a Maju terus TNI ku☺,maju terus tni ku
@kusuma4a Pernyataan Bapak KASAD menunjukkan kepemimpinan yang tanggap dan penuh kepedulian terhadap masyarakat terdampak bencana.,pernyataan bapak kasad menunjukkan kepemimpinan yang tanggap dan penuh kepedulian terhadap masyarakat terdampak bencana
"@kusuma4a Terima kasih TNI,",terima kasih tni
"@kusuma4a TNI dekat dengan rakyat, itulah kekuatan terbesar bangsa ini.",tni dekat dengan rakyat itulah kekuatan terbesar bangsa ini
@kusuma4a Jerih payah TNI yg bertugas patut di acungi 4 jempol👍👍👍👍😃,jerih payah tni yg bertugas patut di acungi jempol
@kusuma4a Tetap semangat TNI,tetap semangat tni
@kusuma4a Mantap bapak,mantap bapak
"@kusuma4a Salut respon TNI cepat, bravo TNI",salut respon tni cepat bravo tni
"@kusuma4a Teruslah berbakti untuk negeri, TNI AD jaya selalu di bawah Pak KASAD.",teruslah berbakti untuk negeri tni ad jaya selalu di bawah pak kasad
@kusuma4a Langkah ini mencerminkan komitmen nyata TNI AD dalam melindungi dan melayani rakyat.,langkah ini mencerminkan komitmen nyata tni ad dalam melindungi dan melayani rakyat
@kusuma4a Kecepatan pengerahan bantuan membuktikan kesiapsiagaan TNI AD yang sangat baik dalam situasi darurat.,kecepatan pengerahan bantuan membuktikan kesiapsiagaan tni ad yang sangat baik dalam situasi darurat
@kusuma4a Tetap semangat TNI AD Rakyat bersama kalian.,tetap semangat tni ad rakyat bersama kalian
@kusuma4a TNI AD kembali membuktikan perannya sebagai garda terdepan dalam membantu masyarakat.,tni ad kembali membuktikan perannya sebagai garda terdepan dalam membantu masyarakat
@kusuma4a Kepemimpinan Bapak KASAD patut menjadi contoh dalam penanganan situasi krisis.,kepemimpinan bapak kasad patut menjadi contoh dalam penanganan situasi krisis
@kusuma4a Pengerahan bantuan yang cepat mencerminkan kesiapan personel dan logistik yang matang.,pengerahan bantuan yang cepat mencerminkan kesiapan personel dan logistik yang matang
@kusuma4a Kepedulian terhadap korban bencana terlihat jelas dari instruksi yang disampaikan Bapak KASAD.,kepedulian terhadap korban bencana terlihat jelas dari instruksi yang disampaikan bapak kasad
"@kusuma4a salut sama responnya TNI yg super cepat, respect banget buat pak TNI ❤️",salut sama responnya tni yg super cepat respect banget buat pak tni
@kusuma4a Aksi cepat TNI AD patut diapresiasi dan dibanggakan.,aksi cepat tni ad patut diapresiasi dan dibanggakan
"@kusuma4a Bantuan cepat sangat penting, dan TNI AD sudah melakukannya dengan baik dan tepat sasaran dengan upaya pemulihan.",bantuan cepat sangat penting dan tni ad sudah melakukannya dengan baik dan tepat sasaran dengan upaya pemulihan
@kusuma4a TNI AD benar-benar membuktikan profesionalisme dan kepedulian sosial.,tni ad benarbenar membuktikan profesionalisme dan kepedulian sosial
@kusuma4a TNI AD dan masyarakat bersama-sama membuktikan kekuatan gotong royong Indonesia.,tni ad dan masyarakat bersamasama membuktikan kekuatan gotong royong indonesia
@kusuma4a Pernyataan Kasad sesuai dengan realita di lapangan.,pernyataan kasad sesuai dengan realita di lapangan
@kusuma4a TNI AD menunjukkan bahwa mereka selalu ada untuk rakyat.,tni ad menunjukkan bahwa mereka selalu ada untuk rakyat
@kusuma4a TNI AD membuktikan bahwa mereka bekerja dengan hati.,tni ad membuktikan bahwa mereka bekerja dengan hati
@kusuma4a Pernyataan Kasad sesuai dengan kondisi di lapangan.,pernyataan kasad sesuai dengan kondisi di lapangan
@kusuma4a TNI AD selalu menjadi garda terdepan saat bencana.,tni ad selalu menjadi garda terdepan saat bencana
@kusuma4a Pernyataan Kasad menegaskan komitmen pengabdian.,pernyataan kasad menegaskan komitmen pengabdian
@kusuma4a Respon cepat TNI AD sangat dirasakan manfaatnya.,respon cepat tni ad sangat dirasakan manfaatnya
@kusuma4a TNI AD selalu mengutamakan keselamatan rakyat.,tni ad selalu mengutamakan keselamatan rakyat
@kusuma4a Sinergi ini mempercepat pemulihan pascabencana.,sinergi ini mempercepat pemulihan pascabencana
"@kusuma4a terimakasih bapak, semoga sumatera cepat pulih 🥰",terimakasih bapak semoga sumatera cepat pulih
"@msaid_didu @prabowo Ternak ternak anjik Muljok, komen yg pakek otak ya, dah gitu aja",ternak ternak anjik muljok komen yg pakek otak ya dah gitu aja
"@msaid_didu @prabowo menurut saya presiden kita ini sering disalahpahami tindak tanduknya, kasihan beliau",menurut saya presiden kita ini sering disalahpahami tindak tanduknya kasihan beliau
"@msaid_didu @prabowo Banyak omong emang ini orang, nggk jelas",banyak omong emang ini orang nggk jelas
@msaid_didu @prabowo lagi nyari loker menteri sm komisaris y pak?,lagi nyari loker menteri sm komisaris y pak
"@msaid_didu @prabowo Ehm itu sih jawabannya, yaaaaa karena balasa jasa....",ehm itu sih jawabannya yaaaaa karena balasa jasa
@msaid_didu @prabowo Mau tau apa banget nih ‼️postingan subuh alim udah siang kayak iblis ❓,mau tau apa banget nih postingan subuh alim udah siang kayak iblis
@msaid_didu @prabowo Coba tanya mindra @Gerindra ? Kenapa gak punya nyali,coba tanya mindra kenapa gak punya nyali
@msaid_didu @prabowo biarkan takdir yg menjawab,biarkan takdir yg menjawab
@msaid_didu @prabowo Pak ....minuman di meja bisa jadi bahan gorengan para pembenci lho pak.....😁,pak minuman di meja bisa jadi bahan gorengan para pembenci lho pak
@msaid_didu @prabowo Ayo kita dukung kinerja pemerintahan saat ini.,ayo kita dukung kinerja pemerintahan saat ini
"@msaid_didu @prabowo Itu mah bukan diskusi, tapi gibah 🤣",itu mah bukan diskusi tapi gibah
"@msaid_didu @prabowo Tuhan kok dibawa2, ciri2 anak abah,",tuhan kok dibawa ciri anak abah
@msaid_didu @prabowo Sukanya kok nggoreng2,sukanya kok nggoreng
@msaid_didu @prabowo Jangan bawa_bawa ALLAH buat bernarasi politik dan penggiringan opini di sosmed..gak elok ah.,jangan bawa_bawa allah buat bernarasi politik dan penggiringan opini di sosmedgak elok ah
"@msaid_didu @prabowo Seharusnya anda jg bertanya pd diri anda sendiri ketika anda berada dilingkup birokrasi, kontribusi apa yg sudah anda berikan ? Knp anda di diskualifikasi ? Brrti anda tdk punya kapasitas /nir ilmu skrg ngoceh ini itu dlu anda ngapain ?",seharusnya anda jg bertanya pd diri anda sendiri ketika anda berada dilingkup birokrasi kontribusi apa yg sudah anda berikan knp anda di diskualifikasi brrti anda tdk punya kapasitas nir ilmu skrg ngoceh ini itu dlu anda ngapain
@msaid_didu @prabowo https://t.co/zgdNsGwwJR,
"@msaid_didu @prabowo Bukan tidak berani, tapi beliau lebih paham dari kita semua.",bukan tidak berani tapi beliau lebih paham dari kita semua
@msaid_didu @prabowo Komen2nya kok mirip2 ya..kayak buzzer ada yg ksh komando. Wkwkwk,komennya kok mirip yakayak buzzer ada yg ksh komando wkwkwk
@msaid_didu @prabowo diskusi pejabat nato pasti didengar,diskusi pejabat nato pasti didengar
@msaid_didu @prabowo pengen tau aja nih,pengen tau aja nih
@msaid_didu @prabowo @jokowi alias Hinanto.,alias hinanto
"@msaid_didu @prabowo ""Jawaban saya, hanya Allah, Prabowo, Jokowi, dan Sigit yang tahu.""

Jika gak tau lebih baik gak usah berprasangka... itu ghibah...
Gitu aja kok repot...",jawaban saya hanya allah prabowo jokowi dan sigit yang tahu jika gak tau lebih baik gak usah berprasangka itu ghibah gitu aja kok repot
@msaid_didu @prabowo Malaikalmaut juga ga' tau ye pak?,malaikalmaut juga ga tau ye pak
@msaid_didu @prabowo Mana bisa Prabowo Presiden tanpa Parcok ????,mana bisa prabowo presiden tanpa parcok
"@msaid_didu @prabowo Transisi kepemimpinan butuh ketenangan dan persatuan, bukan kegaduhan. Presiden Prabowo terlihat fokus menjaga kesinambungan dan stabilitas nasional agar program berjalan lancar",transisi kepemimpinan butuh ketenangan dan persatuan bukan kegaduhan presiden prabowo terlihat fokus menjaga kesinambungan dan stabilitas nasional agar program berjalan lancar
@msaid_didu @prabowo jgn ngomong tanpa bukti bos!!,jgn ngomong tanpa bukti bos
@msaid_didu @prabowo Presiden pasti tau yang terbaik bagi rakyatnya👍🏻,presiden pasti tau yang terbaik bagi rakyatnya
@msaid_didu @prabowo Prov.said didu menjelaskana..........,provsaid didu menjelaskana
"@msaid_didu @prabowo @prabowo tunggu tahun Cina, tahun kuda api Feb 2026 besok utk lakukan lompatan. Kan berkuda salah satu keahliannya.",tunggu tahun cina tahun kuda api feb besok utk lakukan lompatan kan berkuda salah satu keahliannya
@msaid_didu @prabowo Akun provokator ini,akun provokator ini
@msaid_didu @prabowo Diskusi tapi serba gatau isinya terus apa yg diobrolin😭,diskusi tapi serba gatau isinya terus apa yg diobrolin
@msaid_didu @prabowo Bilang saja tersandera,bilang saja tersandera
@msaid_didu @prabowo merit system tho,merit system tho
"@msaid_didu @prabowo Membawa isu internal negara ke forum internasional bukan sikap kritis, melainkan membuka ruang spekulasi dan stigma negatif terhadap bangsa sendiri di mata dunia.",membawa isu internal negara ke forum internasional bukan sikap kritis melainkan membuka ruang spekulasi dan stigma negatif terhadap bangsa sendiri di mata dunia
@msaid_didu @prabowo Malaikat jin juga pak kayaknya tahu juga hehe,malaikat jin juga pak kayaknya tahu juga hehe
"@msaid_didu @prabowo Presiden Prabowo memilih stabilitas dan proses hukum yang objektif, bukan langkah tergesa atau bermuatan politik, demi menjaga kepercayaan publik dan kesinambungan negara.",presiden prabowo memilih stabilitas dan proses hukum yang objektif bukan langkah tergesa atau bermuatan politik demi menjaga kepercayaan publik dan kesinambungan negara
"@msaid_didu @prabowo Beragam pandangan tentu wajar muncul dlm diskusi publik, termasuk di kalangan diaspora. Tp, penting utk melihat bahwa setiap presiden pny pertimbangan strategis, konstitusional, &amp; stabilitas nasional dlm mengambil keputusan.",beragam pandangan tentu wajar muncul dlm diskusi publik termasuk di kalangan diaspora tp penting utk melihat bahwa setiap presiden pny pertimbangan strategis konstitusional amp stabilitas nasional dlm mengambil keputusan
@msaid_didu @prabowo Sigit itu. Siapa?,sigit itu siapa
@msaid_didu @prabowo Semua tersandera kepentingan,semua tersandera kepentingan
@msaid_didu @Ololehomask02 @prabowo krn 58,krn
@msaid_didu @prabowo Semoga Allah segera memberikan kekuatan dan perlindungan utk menegakkan kebenaran,semoga allah segera memberikan kekuatan dan perlindungan utk menegakkan kebenaran
"@msaid_didu @prabowo Sejauh ini, penunjukan pejabat di pemerintahan Pak Prabowo terlihat berbasis rekam jejak dan prestasi. Jadi sebaiknya penilaian tidak dilakukan hanya dari satu sudut pandang, ya bro",sejauh ini penunjukan pejabat di pemerintahan pak prabowo terlihat berbasis rekam jejak dan prestasi jadi sebaiknya penilaian tidak dilakukan hanya dari satu sudut pandang ya bro
@msaid_didu @prabowo Hutang Budi Pilpres,hutang budi pilpres
"@msaid_didu @prabowo Spekulasi kayak gini tuh kebanyakan asumsi, padahal keputusan Prabowo soal aparat itu urusan strategi negara, bukan soal berani atau nggaknya",spekulasi kayak gini tuh kebanyakan asumsi padahal keputusan prabowo soal aparat itu urusan strategi negara bukan soal berani atau nggaknya
@msaid_didu @prabowo 👍👍,
@msaid_didu @prabowo Diskusi yang menarik. Semoga masukan-masukan dari rekan-rekan diaspora bisa menjadi kontribusi positif bagi perbaikan birokrasi dan kepemimpinan di tanah air,diskusi yang menarik semoga masukanmasukan dari rekanrekan diaspora bisa menjadi kontribusi positif bagi perbaikan birokrasi dan kepemimpinan di tanah air
"@msaid_didu @prabowo Jawaban yang pasti "" Hutang Budi""",jawaban yang pasti hutang budi
